{
  "id": "adjectives-and-adverbs",
  "title": "Adjectives and Adverbs",
  "body": "This section details <alman />'s single form-based principle for adjective and adverb morphology: every declensional adjective ending of <sd /> is replaced by the invariant -e, and forms without declensional endings remain unchanged. The principle applies by surface form, not syntactic function — attributive adjectives (gute Mann), nominalized adjectives (die Gute), and fixed adverbial expressions (unter anderem → unter andere) all take -e, while predicative adjectives and adverbs stay as they are. The sole exception is the adverbial superlative, which replaces the <sd /> **am** + superlative construction with the bare superlative stem (am besten → best).",
  "paragraphs": [
    {
      "id": "adjectives"
    },
    {
      "id": "adverbs"
    }
  ]
}
