{
  "id": "introduction",
  "title": "Introduction",
  "body": "The noun gender system of the German language, colloquially referred to as “der/die/das,” is notoriously difficult for those who learn German as an additional language (L2). We advocate that correct usage of noun genders is not crucial for most L2 learners in order to function in the German society. To this end, we construct a dialect, called <alman />, that unifies the masculine, feminine, and neuter genders into a single category and eliminates gender- and case-specific inflections. The resulting gender loss is akin to that experienced by English during the Middle English period. We present a formal description of <alman /> grammar.\n\nThe idea of <alman /> came out of the recognition that language complexity—especially in morphological systems like noun gender—can slow down language learning and hinder a foreigner's integration into the society. We claim that higher grammatical complexity comes with real-world costs, including delayed workforce integration and diminished productivity for migrants. By removing the necessity to memorize or deploy multiple gender markers, <alman /> seeks to mitigate these challenges without compromising the fundamental structure of German syntax and vocabulary.\n\nBeyond its practical benefits for newcomers, <alman /> remains mutually intelligible with <sd />. The dialect is designed to preserve essential word order (verb-second in main clauses and verb-final in subordinate clauses), retain well-known verb conjugations, and maintain overall lexical clarity. Rather than overhauling the entire grammar, it strategically reduces complexity where it matters most—namely in article usage, noun inflection, and adjective endings—allowing L2 learners to communicate more confidently at an earlier stage.\n\nThis specification provides a formal account of <alman /> grammar, detailing the rules for article simplification, noun morphology, adjectival endings, and other core linguistic elements. By illustrating these changes with numerous examples, we aim to offer both instructors and learners a clear roadmap for adopting this dialect. The goal is not to replace <sd /> but to introduce an accessible version that addresses pain points for adult learners, ultimately fostering a more inclusive and efficient language learning.",
  "i18n": {
    "de": {
      "title": "Einleitung",
      "body": "Das Genussystem der deutschen Sprache, umgangssprachlich als „der/die/das“ bezeichnet, ist für diejenigen, die Deutsch als zusätzliche Sprache (L2) lernen, notorisch schwierig. Wir vertreten die Auffassung, dass die korrekte Verwendung der Genera für die meisten L2-Lernenden nicht entscheidend ist, um in der deutschen Gesellschaft zu funktionieren. Zu diesem Zweck konstruieren wir einen Dialekt namens <alman />, der die Genera Maskulinum, Femininum und Neutrum zu einer einzigen Kategorie vereinigt und genus- und kasusspezifische Flexionen beseitigt. Der daraus resultierende Genusverlust ähnelt demjenigen, den das Englische während der mittelenglischen Periode erfahren hat. Wir legen eine formale Beschreibung der <alman />-Grammatik vor.\n\nDie Idee zu <alman /> entstand aus der Erkenntnis, dass Sprachkomplexität – insbesondere in morphologischen Systemen wie dem Genus – das Sprachenlernen verlangsamen und die Integration von Zugewanderten in die Gesellschaft behindern kann. Wir vertreten die These, dass höhere grammatische Komplexität reale Kosten verursacht, darunter eine verzögerte Integration in den Arbeitsmarkt und eine verringerte Produktivität von Migranten. Indem <alman /> die Notwendigkeit beseitigt, mehrere Genusmarker zu memorieren und anzuwenden, will es diese Herausforderungen mildern, ohne die grundlegende Struktur der deutschen Syntax und des Wortschatzes zu beeinträchtigen.\n\nÜber den praktischen Nutzen für Neuankömmlinge hinaus bleibt <alman /> mit <sd /> gegenseitig verständlich. Der Dialekt ist darauf ausgelegt, die wesentliche Wortstellung zu bewahren (Verbzweitstellung in Hauptsätzen und Verbendstellung in Nebensätzen), die vertrauten Verbkonjugationen beizubehalten und die lexikalische Klarheit insgesamt zu erhalten. Statt die gesamte Grammatik umzubauen, reduziert er die Komplexität gezielt dort, wo sie am meisten ins Gewicht fällt – nämlich beim Artikelgebrauch, bei der Substantivflexion und bei den Adjektivendungen – und erlaubt es L2-Lernenden so, schon früher selbstbewusster zu kommunizieren.\n\nDiese Spezifikation liefert eine formale Darstellung der <alman />-Grammatik und beschreibt im Einzelnen die Regeln für die Artikelvereinfachung, die Substantivmorphologie, die Adjektivendungen und weitere zentrale sprachliche Elemente. Indem wir diese Änderungen mit zahlreichen Beispielen veranschaulichen, wollen wir Lehrenden wie Lernenden einen klaren Fahrplan für die Übernahme dieses Dialekts bieten. Ziel ist nicht, <sd /> zu ersetzen, sondern eine zugängliche Variante einzuführen, die die Schwierigkeiten erwachsener Lernender adressiert und letztlich ein inklusiveres und effizienteres Sprachenlernen fördert."
    },
    "al": {
      "title": "Einleitung",
      "body": "Die Genussystem der deutsche Sprache, umgangssprachlich als „der/die/das“ bezeichnet, ist für diejenigen, die Deutsch als zusätzliche Sprache (L2) lernen, notorisch schwierig. Wir vertreten die Auffassung, dass die korrekte Verwendung der Genera für die meiste L2-Lernenden nicht entscheidend ist, um in die deutsche Gesellschaft zu funktionieren. Zu diese Zweck konstruieren wir ein Dialekt namens <alman />, die die Genera Maskulinum, Femininum und Neutrum zu ein einzige Kategorie vereinigt und genus- und kasusspezifische Flexionen beseitigt. Die daraus resultierende Genusverlust ähnelt diejenige, die die Englische während der mittelenglische Periode erfahren hat. Wir legen ein formale Beschreibung der <alman />-Grammatik vor.\n\nDie Idee zu <alman /> entstand aus die Erkenntnis, dass Sprachkomplexität – insbesondere in morphologische Systeme wie die Genus – die Sprachenlernen verlangsamen und die Integration von Zugewanderten in die Gesellschaft behindern kann. Wir vertreten die These, dass höhere grammatische Komplexität reale Kosten verursacht, darunter ein verzögerte Integration in die Arbeitsmarkt und ein verringerte Produktivität von Migranten. Indem <alman /> die Notwendigkeit beseitigt, mehrere Genusmarker zu memorieren und anzuwenden, will es diese Herausforderungen mildern, ohne die grundlegende Struktur der deutsche Syntax und der Wortschatz zu beeinträchtigen.\n\nÜber die praktische Nutzen für Neuankömmlinge hinaus bleibt <alman /> mit <sd /> gegenseitig verständlich. Die Dialekt ist darauf ausgelegt, die wesentliche Wortstellung zu bewahren (Verbzweitstellung in Hauptsätze und Verbendstellung in Nebensätze), die vertraute Verbkonjugationen beizubehalten und die lexikalische Klarheit insgesamt zu erhalten. Statt die gesamte Grammatik umzubauen, reduziert es die Komplexität gezielt dort, wo sie meist in die Gewicht fällt – nämlich bei die Artikelgebrauch, bei die Substantivflexion und bei die Adjektivendungen – und erlaubt es L2-Lernenden so, schon früher selbstbewusster zu kommunizieren.\n\nDiese Spezifikation liefert ein formale Darstellung der <alman />-Grammatik und beschreibt in die Einzelne die Regeln für die Artikelvereinfachung, die Substantivmorphologie, die Adjektivendungen und weitere zentrale sprachliche Elemente. Indem wir diese Änderungen mit zahlreiche Beispiele veranschaulichen, wollen wir Lehrenden wie Lernenden ein klare Fahrplan für die Übernahme von diese Dialekt bieten. Ziel ist nicht, <sd /> zu ersetzen, sondern ein zugängliche Variante einzuführen, die die Schwierigkeiten von erwachsene Lernenden adressiert und letztlich ein inklusivere und effizientere Sprachenlernen fördert."
    }
  },
  "paragraphs": []
}