{
  "id": "articles",
  "title": "Articles",
  "body": "This section outlines the simplification of <sd /> articles in <alman />, eliminating grammatical gender and case distinctions. Definite articles use **die** for all non-genitive contexts and **der** for genitive, with **das** retained as a neutral demonstrative. Possession may alternatively use **von die** instead of genitive constructions. Indefinite articles adopt **ein** universally in non-genitive cases, while genitive employs **von ein** or retains **ein** with prepositions. Preposition-article contractions are resolved to full forms without exception (e.g., *vom* → *von die*), and nominalized articles preserve **ein** as standalone forms. The case distinction after two-way prepositions is abolished for noun phrases.",
  "i18n": {
    "de": {
      "title": "Artikel",
      "body": "Dieser Abschnitt beschreibt die Vereinfachung der <sd />-Artikel in <alman />, bei der Genus- und Kasusunterscheidungen beseitigt werden. Bestimmte Artikel verwenden **die** für alle nicht-genitivischen Kontexte und **der** für den Genitiv, wobei **das** als neutrales Demonstrativum erhalten bleibt. Besitz kann alternativ mit **von die** statt mit Genitivkonstruktionen ausgedrückt werden. Unbestimmte Artikel übernehmen in nicht-genitivischen Fällen durchgängig **ein**, während der Genitiv **von ein** verwendet oder **ein** nach Präpositionen beibehält. Präposition-Artikel-Verschmelzungen werden ausnahmslos zu ihren vollen Formen aufgelöst (z. B. *vom* → *von die*), und nominalisierte Artikel bewahren **ein** als eigenständige Form. Die Kasusunterscheidung nach Wechselpräpositionen wird für Nominalphrasen abgeschafft."
    },
    "al": {
      "title": "Artikel",
      "body": "Diese Abschnitt beschreibt die Vereinfachung der <sd />-Artikel in <alman />, bei die Genus- und Kasusunterscheidungen beseitigt werden. Bestimmte Artikel verwenden **die** für alle nicht-genitivische Kontexte und **der** für die Genitiv, wobei **das** als neutrale Demonstrativum erhalten bleibt. Besitz kann alternativ mit **von die** statt mit Genitivkonstruktionen ausgedrückt werden. Unbestimmte Artikel übernehmen in nicht-genitivische Fälle durchgängig **ein**, während die Genitiv **von ein** verwendet oder **ein** nach Präpositionen beibehält. Präposition-Artikel-Verschmelzungen werden ausnahmslos zu ihre volle Formen aufgelöst (z. B. *vom* → *von die*), und nominalisierte Artikel bewahren **ein** als eigenständige Form. Die Kasusunterscheidung nach Wechselpräpositionen wird für Nominalphrasen abgeschafft."
    }
  },
  "paragraphs": [
    {
      "id": "definite-articles"
    },
    {
      "id": "indefinite-articles"
    }
  ]
}