{
  "id": "lexical-gender",
  "title": "Lexical Gender Simplifications",
  "body": "This section outlines the systematic elimination of gender-specific lexical forms in <alman />, covering person-denoting nouns such as occupational titles, nationalities, and role descriptions. It describes how traditionally gendered word pairs are consolidated into a single form, using the historically masculine base form with the invariant article system to denote all referents regardless of gender.",
  "paragraphs": [
    {
      "id": "job-titles"
    }
  ]
}